<?xml version="1.0" encoding="iso-8859-1"?>
<!DOCTYPE forms SYSTEM "SL_morph.dtd">
<!-- header
<meta name="title" content="Sanskrit Morphology"; ps ">
<meta name="author" content="
G&#233;rard Huet"><meta name="date" content="
21 Juin 2017"><meta name="copyright" content="
&#169; G&#233;rard Huet 1994-2017"><meta name="keywords" content="sanskrit; morphology"> -->
<forms>
<f form="adas"><na><acc/><sg/><neu/></na><na><nom/><sg/><neu/></na><s stem="adas"/></f>
<f form="aDarayA"><na><ins/><sg/><fem/></na><s stem="aDara"/></f>
<f form="aDarayos"><na><loc/><du/><fem/></na><na><gen/><du/><fem/></na><s stem="aDara"/></f>
<f form="aDarasyAm"><na><loc/><sg/><fem/></na><s stem="aDara"/></f>
<f form="aDarasyAs"><na><gen/><sg/><fem/></na><na><abl/><sg/><fem/></na><s stem="aDara"/></f>
<f form="aDarasyE"><na><dat/><sg/><fem/></na><s stem="aDara"/></f>
<f form="aDarA"><na><nom/><sg/><fem/></na><s stem="aDara"/></f>
<f form="aDarABis"><na><ins/><pl/><fem/></na><s stem="aDara"/></f>
<f form="aDarAByas"><na><abl/><pl/><fem/></na><na><dat/><pl/><fem/></na><s stem="aDara"/></f>
<f form="aDarAByAm"><na><abl/><du/><fem/></na><na><dat/><du/><fem/></na><na><ins/><du/><fem/></na><s stem="aDara"/></f>
<f form="aDarAm"><na><acc/><sg/><fem/></na><s stem="aDara"/></f>
<f form="aDarAs"><na><acc/><pl/><fem/></na><na><nom/><pl/><fem/></na><s stem="aDara"/></f>
<f form="aDarAsAm"><na><gen/><pl/><fem/></na><s stem="aDara"/></f>
<f form="aDarAsu"><na><loc/><pl/><fem/></na><s stem="aDara"/></f>
<f form="aDare"><na><acc/><du/><fem/></na><na><nom/><du/><fem/></na><s stem="aDara"/></f>
<f form="anayA"><na><ins/><sg/><fem/></na><s stem="idam"/></f>
<f form="anayos"><na><loc/><du/><neu/></na><na><gen/><du/><neu/></na><na><loc/><du/><mas/></na><na><gen/><du/><mas/></na><na><loc/><du/><fem/></na><na><gen/><du/><fem/></na><s stem="idam"/></f>
<f form="anekayA"><na><ins/><sg/><fem/></na><s stem="aneka"/></f>
<f form="anekayos"><na><loc/><du/><fem/></na><na><gen/><du/><fem/></na><s stem="aneka"/></f>
<f form="anekasyAm"><na><loc/><sg/><fem/></na><s stem="aneka"/></f>
<f form="anekasyAs"><na><gen/><sg/><fem/></na><na><abl/><sg/><fem/></na><s stem="aneka"/></f>
<f form="anekasyE"><na><dat/><sg/><fem/></na><s stem="aneka"/></f>
<f form="anekA"><na><nom/><sg/><fem/></na><s stem="aneka"/></f>
<f form="anekABis"><na><ins/><pl/><fem/></na><s stem="aneka"/></f>
<f form="anekAByas"><na><abl/><pl/><fem/></na><na><dat/><pl/><fem/></na><s stem="aneka"/></f>
<f form="anekAByAm"><na><abl/><du/><fem/></na><na><dat/><du/><fem/></na><na><ins/><du/><fem/></na><s stem="aneka"/></f>
<f form="anekAm"><na><acc/><sg/><fem/></na><s stem="aneka"/></f>
<f form="anekAs"><na><acc/><pl/><fem/></na><na><nom/><pl/><fem/></na><s stem="aneka"/></f>
<f form="anekAsAm"><na><gen/><pl/><fem/></na><s stem="aneka"/></f>
<f form="anekAsu"><na><loc/><pl/><fem/></na><s stem="aneka"/></f>
<f form="aneke"><na><acc/><du/><fem/></na><na><nom/><du/><fem/></na><s stem="aneka"/></f>
<f form="anena"><na><ins/><sg/><neu/></na><na><ins/><sg/><mas/></na><s stem="idam"/></f>
<f form="antarayA"><na><ins/><sg/><fem/></na><s stem="antara"/></f>
<f form="antarayos"><na><loc/><du/><fem/></na><na><gen/><du/><fem/></na><s stem="antara"/></f>
<f form="antarasyAm"><na><loc/><sg/><fem/></na><s stem="antara"/></f>
<f form="antarasyAs"><na><gen/><sg/><fem/></na><na><abl/><sg/><fem/></na><s stem="antara"/></f>
<f form="antarasyE"><na><dat/><sg/><fem/></na><s stem="antara"/></f>
<f form="antarA"><na><nom/><sg/><fem/></na><s stem="antara"/></f>
<f form="antarABis"><na><ins/><pl/><fem/></na><s stem="antara"/></f>
<f form="antarAByas"><na><abl/><pl/><fem/></na><na><dat/><pl/><fem/></na><s stem="antara"/></f>
<f form="antarAByAm"><na><abl/><du/><fem/></na><na><dat/><du/><fem/></na><na><ins/><du/><fem/></na><s stem="antara"/></f>
<f form="antarAm"><na><acc/><sg/><fem/></na><s stem="antara"/></f>
<f form="antarAs"><na><acc/><pl/><fem/></na><na><nom/><pl/><fem/></na><s stem="antara"/></f>
<f form="antarAsAm"><na><gen/><pl/><fem/></na><s stem="antara"/></f>
<f form="antarAsu"><na><loc/><pl/><fem/></na><s stem="antara"/></f>
<f form="antare"><na><acc/><du/><fem/></na><na><nom/><du/><fem/></na><s stem="antara"/></f>
<f form="anyat"><na><acc/><sg/><neu/></na><na><nom/><sg/><neu/></na><s stem="anya"/></f>
<f form="anyatarat"><na><acc/><sg/><neu/></na><na><nom/><sg/><neu/></na><s stem="anyatara"/></f>
<f form="anyataram"><na><acc/><sg/><mas/></na><s stem="anyatara"/></f>
<f form="anyatarayA"><na><ins/><sg/><fem/></na><s stem="anyatara"/></f>
<f form="anyatarayos"><na><loc/><du/><mas/></na><na><gen/><du/><mas/></na><na><loc/><du/><fem/></na><na><gen/><du/><fem/></na><na><loc/><du/><neu/></na><na><gen/><du/><neu/></na><s stem="anyatara"/></f>
<f form="anyataras"><na><nom/><sg/><mas/></na><s stem="anyatara"/></f>
<f form="anyatarasmAt"><na><abl/><sg/><mas/></na><na><abl/><sg/><neu/></na><s stem="anyatara"/></f>
<f form="anyatarasmin"><na><loc/><sg/><mas/></na><na><loc/><sg/><neu/></na><s stem="anyatara"/></f>
<f form="anyatarasmE"><na><dat/><sg/><mas/></na><na><dat/><sg/><neu/></na><s stem="anyatara"/></f>
<f form="anyatarasya"><na><gen/><sg/><mas/></na><na><gen/><sg/><neu/></na><s stem="anyatara"/></f>
<f form="anyatarasyAm"><na><loc/><sg/><fem/></na><s stem="anyatara"/></f>
<f form="anyatarasyAs"><na><gen/><sg/><fem/></na><na><abl/><sg/><fem/></na><s stem="anyatara"/></f>
<f form="anyatarasyE"><na><dat/><sg/><fem/></na><s stem="anyatara"/></f>
<f form="anyatarA"><na><nom/><sg/><fem/></na><s stem="anyatara"/></f>
<f form="anyatarARi"><na><acc/><pl/><neu/></na><na><nom/><pl/><neu/></na><s stem="anyatara"/></f>
<f form="anyatarAn"><na><acc/><pl/><mas/></na><s stem="anyatara"/></f>
<f form="anyatarABis"><na><ins/><pl/><fem/></na><s stem="anyatara"/></f>
<f form="anyatarAByas"><na><abl/><pl/><fem/></na><na><dat/><pl/><fem/></na><s stem="anyatara"/></f>
<f form="anyatarAByAm"><na><abl/><du/><mas/></na><na><dat/><du/><mas/></na><na><ins/><du/><mas/></na><na><abl/><du/><fem/></na><na><dat/><du/><fem/></na><na><ins/><du/><fem/></na><na><abl/><du/><neu/></na><na><dat/><du/><neu/></na><na><ins/><du/><neu/></na><s stem="anyatara"/></f>
<f form="anyatarAm"><na><acc/><sg/><fem/></na><s stem="anyatara"/></f>
<f form="anyatarAs"><na><acc/><pl/><fem/></na><na><nom/><pl/><fem/></na><s stem="anyatara"/></f>
<f form="anyatarAsAm"><na><gen/><pl/><fem/></na><s stem="anyatara"/></f>
<f form="anyatarAsu"><na><loc/><pl/><fem/></na><s stem="anyatara"/></f>
<f form="anyatare"><na><nom/><pl/><mas/></na><na><acc/><du/><fem/></na><na><nom/><du/><fem/></na><na><acc/><du/><neu/></na><na><nom/><du/><neu/></na><s stem="anyatara"/></f>
<f form="anyatareRa"><na><ins/><sg/><mas/></na><na><ins/><sg/><neu/></na><s stem="anyatara"/></f>
<f form="anyatareByas"><na><abl/><pl/><mas/></na><na><dat/><pl/><mas/></na><na><abl/><pl/><neu/></na><na><dat/><pl/><neu/></na><s stem="anyatara"/></f>
<f form="anyatarezAm"><na><gen/><pl/><mas/></na><na><gen/><pl/><neu/></na><s stem="anyatara"/></f>
<f form="anyatarezu"><na><loc/><pl/><mas/></na><na><loc/><pl/><neu/></na><s stem="anyatara"/></f>
<f form="anyatarEs"><na><ins/><pl/><mas/></na><na><ins/><pl/><neu/></na><s stem="anyatara"/></f>
<f form="anyatarO"><na><acc/><du/><mas/></na><na><nom/><du/><mas/></na><s stem="anyatara"/></f>
<f form="anyam"><na><acc/><sg/><mas/></na><s stem="anya"/></f>
<f form="anyayA"><na><ins/><sg/><fem/></na><s stem="anya"/></f>
<f form="anyayos"><na><loc/><du/><mas/></na><na><gen/><du/><mas/></na><na><loc/><du/><fem/></na><na><gen/><du/><fem/></na><na><loc/><du/><neu/></na><na><gen/><du/><neu/></na><s stem="anya"/></f>
<f form="anyas"><na><nom/><sg/><mas/></na><s stem="anya"/></f>
<f form="anyasmAt"><na><abl/><sg/><mas/></na><na><abl/><sg/><neu/></na><s stem="anya"/></f>
<f form="anyasmin"><na><loc/><sg/><mas/></na><na><loc/><sg/><neu/></na><s stem="anya"/></f>
<f form="anyasmE"><na><dat/><sg/><mas/></na><na><dat/><sg/><neu/></na><s stem="anya"/></f>
<f form="anyasya"><na><gen/><sg/><mas/></na><na><gen/><sg/><neu/></na><s stem="anya"/></f>
<f form="anyasyAm"><na><loc/><sg/><fem/></na><s stem="anya"/></f>
<f form="anyasyAs"><na><gen/><sg/><fem/></na><na><abl/><sg/><fem/></na><s stem="anya"/></f>
<f form="anyasyE"><na><dat/><sg/><fem/></na><s stem="anya"/></f>
<f form="anyA"><na><nom/><sg/><fem/></na><s stem="anya"/></f>
<f form="anyAn"><na><acc/><pl/><mas/></na><s stem="anya"/></f>
<f form="anyAni"><na><acc/><pl/><neu/></na><na><nom/><pl/><neu/></na><s stem="anya"/></f>
<f form="anyABis"><na><ins/><pl/><fem/></na><s stem="anya"/></f>
<f form="anyAByas"><na><abl/><pl/><fem/></na><na><dat/><pl/><fem/></na><s stem="anya"/></f>
<f form="anyAByAm"><na><abl/><du/><mas/></na><na><dat/><du/><mas/></na><na><ins/><du/><mas/></na><na><abl/><du/><fem/></na><na><dat/><du/><fem/></na><na><ins/><du/><fem/></na><na><abl/><du/><neu/></na><na><dat/><du/><neu/></na><na><ins/><du/><neu/></na><s stem="anya"/></f>
<f form="anyAm"><na><acc/><sg/><fem/></na><s stem="anya"/></f>
<f form="anyAs"><na><acc/><pl/><fem/></na><na><nom/><pl/><fem/></na><s stem="anya"/></f>
<f form="anyAsAm"><na><gen/><pl/><fem/></na><s stem="anya"/></f>
<f form="anyAsu"><na><loc/><pl/><fem/></na><s stem="anya"/></f>
<f form="anye"><na><nom/><pl/><mas/></na><na><acc/><du/><fem/></na><na><nom/><du/><fem/></na><na><acc/><du/><neu/></na><na><nom/><du/><neu/></na><s stem="anya"/></f>
<f form="anyena"><na><ins/><sg/><mas/></na><na><ins/><sg/><neu/></na><s stem="anya"/></f>
<f form="anyeByas"><na><abl/><pl/><mas/></na><na><dat/><pl/><mas/></na><na><abl/><pl/><neu/></na><na><dat/><pl/><neu/></na><s stem="anya"/></f>
<f form="anyezAm"><na><gen/><pl/><mas/></na><na><gen/><pl/><neu/></na><s stem="anya"/></f>
<f form="anyezu"><na><loc/><pl/><mas/></na><na><loc/><pl/><neu/></na><s stem="anya"/></f>
<f form="anyEs"><na><ins/><pl/><mas/></na><na><ins/><pl/><neu/></na><s stem="anya"/></f>
<f form="anyO"><na><acc/><du/><mas/></na><na><nom/><du/><mas/></na><s stem="anya"/></f>
<f form="aparayA"><na><ins/><sg/><fem/></na><s stem="apara"/></f>